{
  "app": {
    "build": "1",
    "version": "0.1.0"
  },
  "capture_modes": [
    "room"
  ],
  "capture_state": "complete",
  "consent": {
    "audio": true,
    "location": true,
    "retention_policy_id": "demo-v1",
    "video": true
  },
  "device": {
    "model": "iPhone",
    "roomplan_version": "1",
    "supports_lidar": true,
    "system_version": "18.0",
    "vision_version": "1"
  },
  "files": [
    {
      "bytes": 3,
      "mime_type": "application/json",
      "path": "roomplan/processed/structure.json",
      "sha256": "ca3d163bab055381827226140568f3bef7eaac187cebd76878e0b63e9e442356"
    }
  ],
  "geography": {
    "city": "New Delhi",
    "country_code": "IN",
    "currency": "INR",
    "market": "en-IN",
    "precise_location_consent": false,
    "region": "Delhi",
    "source": "manual"
  },
  "schema_version": "1.0.0",
  "session_id": "22222222-2222-4222-8222-222222222222",
  "survey_id": "11111111-1111-4111-8111-111111111111",
  "timing": {
    "ended_at": "2026-09-21T10:05:00+05:30",
    "monotonic_anchor_seconds": 100,
    "started_at": "2026-09-21T10:00:00+05:30",
    "timezone": "Asia/Kolkata"
  }
}

